,screen_name,date,text,compound,negative,neutral,positive
0,nytimes,Sat Feb 03 01:33:04 +0000 2018,"It can regrow its limbs and internal organs, but that may not be the most amazing thing about the axolotl. Turns ou… https://t.co/7XdVtd6rCH",0.7677,0.0,0.796,0.204
1,nytimes,Sat Feb 03 01:18:04 +0000 2018,"K. T. McFarland withdraws her nomination to be ambassador to Singapore
https://t.co/LFhSAYgsd8",0.0,0.0,1.0,0.0
2,nytimes,Sat Feb 03 01:03:02 +0000 2018,The flu hospitalization rate is the highest that the CDC has ever recorded at this point in the season https://t.co/DxCJ1QA1zJ,-0.3818,0.12,0.88,0.0
3,nytimes,Sat Feb 03 00:48:02 +0000 2018,RT @nytpolitics: President Trump hinted that senior leaders at the Department of Justice and the F.B.I. should face consequences for conduc…,0.5267,0.0,0.855,0.145
4,nytimes,Sat Feb 03 00:33:05 +0000 2018,"Dozens of entrepreneurs, made newly wealthy by virtual currencies, have moved to Puerto Rico to avoid taxes on thei… https://t.co/LvwhivSPaA",0.0772,0.097,0.793,0.11
5,nytimes,Sat Feb 03 00:18:04 +0000 2018,"One of nearly 9,000 educators protected under DACA, Karen Reyes, who teaches deaf toddlers, has struggled to explai… https://t.co/RCMCBYePSv",0.128,0.108,0.762,0.13
6,nytimes,Sat Feb 03 00:03:05 +0000 2018,Evening Briefing: Here's what you need to know at the end of the day https://t.co/aKk9AQWU7t,0.0,0.0,1.0,0.0
7,nytimes,Fri Feb 02 23:48:05 +0000 2018,Wells Fargo has been ordered to replace 4 board members and limit its growth after the company’s scandal over fraud… https://t.co/pHw1OAaOUF,0.1779,0.118,0.694,0.188
8,nytimes,Fri Feb 02 23:33:05 +0000 2018,"The Best TV shows and movies new to Netflix, Amazon and more in February https://t.co/M74NBd9LX2",0.7096,0.0,0.688,0.312
9,nytimes,Fri Feb 02 23:18:05 +0000 2018,Plans by a Norwegian artist for an unusual new building next to the site of Edvard Munch’s studio have stirred a he… https://t.co/9b0tGuprby,0.0,0.0,1.0,0.0
10,nytimes,Fri Feb 02 23:08:04 +0000 2018,"RT @NYTScience: When the anesthetic wore off, it was almost like these plants were regaining consciousness, something we typically don’t th…",0.2975,0.0,0.901,0.099
11,nytimes,Fri Feb 02 22:56:00 +0000 2018,"In an email to staff, Wayne Pacelle said that because “our mission depends on unity,” he was stepping aside to allo… https://t.co/7qRFMDl9VT",0.0,0.0,1.0,0.0
12,nytimes,Fri Feb 02 22:50:16 +0000 2018,Breaking News: The CEO of the Humane Society of the United States resigned after sexual harassment allegations and… https://t.co/IDKlXlfBGY,-0.4019,0.226,0.658,0.115
13,nytimes,Fri Feb 02 22:43:07 +0000 2018,"The NYT review of Justin Timberlake's new album, ""Man of the Woods"" https://t.co/ikHJeLCwNI",0.0,0.0,1.0,0.0
14,nytimes,Fri Feb 02 22:35:04 +0000 2018,"Kenya's government is defying a court order to put 4 private TV stations back on the air, escalating a week of poli… https://t.co/ZbaNVkpdbL",0.0,0.0,1.0,0.0
15,nytimes,Fri Feb 02 22:31:19 +0000 2018,@pete_wells Salt Bae opened a steakhouse in New York City. We sent our restaurant critic @pete_wells.… https://t.co/MPjDTqFXmg,-0.2732,0.123,0.877,0.0
16,nytimes,Fri Feb 02 22:18:03 +0000 2018,Our reporters analyzed the previously secret GOP memo on the Russia inquiry. Here are their notes alongside the mem… https://t.co/siCQcABdsg,0.0,0.0,1.0,0.0
17,nytimes,Fri Feb 02 22:03:03 +0000 2018,RT @benshpigel: The Eagles' embrace of data and counterintuitive thinking powered them to the Super Bowl. I visited the analytics firm behi…,0.7351,0.0,0.754,0.246
18,nytimes,Fri Feb 02 21:51:06 +0000 2018,"Modern Love: ""I told myself that, despite my own past struggles with fidelity, I would do it better this time"" https://t.co/oUnM3BiIMD",0.6808,0.094,0.639,0.267
19,nytimes,Fri Feb 02 21:35:07 +0000 2018,"As more predators are being brought to justice, more men in England and Wales are reporting abuse and seeking help… https://t.co/GGSpaKVcoj",-0.2023,0.158,0.714,0.128
20,nytimes,Sat Feb 03 01:33:04 +0000 2018,"It can regrow its limbs and internal organs, but that may not be the most amazing thing about the axolotl. Turns ou… https://t.co/7XdVtd6rCH",0.7677,0.0,0.796,0.204
21,nytimes,Sat Feb 03 01:18:04 +0000 2018,"K. T. McFarland withdraws her nomination to be ambassador to Singapore
https://t.co/LFhSAYgsd8",0.0,0.0,1.0,0.0
22,nytimes,Sat Feb 03 01:03:02 +0000 2018,The flu hospitalization rate is the highest that the CDC has ever recorded at this point in the season https://t.co/DxCJ1QA1zJ,-0.3818,0.12,0.88,0.0
23,nytimes,Sat Feb 03 00:48:02 +0000 2018,RT @nytpolitics: President Trump hinted that senior leaders at the Department of Justice and the F.B.I. should face consequences for conduc…,0.5267,0.0,0.855,0.145
24,nytimes,Sat Feb 03 00:33:05 +0000 2018,"Dozens of entrepreneurs, made newly wealthy by virtual currencies, have moved to Puerto Rico to avoid taxes on thei… https://t.co/LvwhivSPaA",0.0772,0.097,0.793,0.11
25,nytimes,Sat Feb 03 00:18:04 +0000 2018,"One of nearly 9,000 educators protected under DACA, Karen Reyes, who teaches deaf toddlers, has struggled to explai… https://t.co/RCMCBYePSv",0.128,0.108,0.762,0.13
26,nytimes,Sat Feb 03 00:03:05 +0000 2018,Evening Briefing: Here's what you need to know at the end of the day https://t.co/aKk9AQWU7t,0.0,0.0,1.0,0.0
27,nytimes,Fri Feb 02 23:48:05 +0000 2018,Wells Fargo has been ordered to replace 4 board members and limit its growth after the company’s scandal over fraud… https://t.co/pHw1OAaOUF,0.1779,0.118,0.694,0.188
28,nytimes,Fri Feb 02 23:33:05 +0000 2018,"The Best TV shows and movies new to Netflix, Amazon and more in February https://t.co/M74NBd9LX2",0.7096,0.0,0.688,0.312
29,nytimes,Fri Feb 02 23:18:05 +0000 2018,Plans by a Norwegian artist for an unusual new building next to the site of Edvard Munch’s studio have stirred a he… https://t.co/9b0tGuprby,0.0,0.0,1.0,0.0
30,nytimes,Fri Feb 02 23:08:04 +0000 2018,"RT @NYTScience: When the anesthetic wore off, it was almost like these plants were regaining consciousness, something we typically don’t th…",0.2975,0.0,0.901,0.099
31,nytimes,Fri Feb 02 22:56:00 +0000 2018,"In an email to staff, Wayne Pacelle said that because “our mission depends on unity,” he was stepping aside to allo… https://t.co/7qRFMDl9VT",0.0,0.0,1.0,0.0
32,nytimes,Fri Feb 02 22:50:16 +0000 2018,Breaking News: The CEO of the Humane Society of the United States resigned after sexual harassment allegations and… https://t.co/IDKlXlfBGY,-0.4019,0.226,0.658,0.115
33,nytimes,Fri Feb 02 22:43:07 +0000 2018,"The NYT review of Justin Timberlake's new album, ""Man of the Woods"" https://t.co/ikHJeLCwNI",0.0,0.0,1.0,0.0
34,nytimes,Fri Feb 02 22:35:04 +0000 2018,"Kenya's government is defying a court order to put 4 private TV stations back on the air, escalating a week of poli… https://t.co/ZbaNVkpdbL",0.0,0.0,1.0,0.0
35,nytimes,Fri Feb 02 22:31:19 +0000 2018,@pete_wells Salt Bae opened a steakhouse in New York City. We sent our restaurant critic @pete_wells.… https://t.co/MPjDTqFXmg,-0.2732,0.123,0.877,0.0
36,nytimes,Fri Feb 02 22:18:03 +0000 2018,Our reporters analyzed the previously secret GOP memo on the Russia inquiry. Here are their notes alongside the mem… https://t.co/siCQcABdsg,0.0,0.0,1.0,0.0
37,nytimes,Fri Feb 02 22:03:03 +0000 2018,RT @benshpigel: The Eagles' embrace of data and counterintuitive thinking powered them to the Super Bowl. I visited the analytics firm behi…,0.7351,0.0,0.754,0.246
38,nytimes,Fri Feb 02 21:51:06 +0000 2018,"Modern Love: ""I told myself that, despite my own past struggles with fidelity, I would do it better this time"" https://t.co/oUnM3BiIMD",0.6808,0.094,0.639,0.267
39,nytimes,Fri Feb 02 21:35:07 +0000 2018,"As more predators are being brought to justice, more men in England and Wales are reporting abuse and seeking help… https://t.co/GGSpaKVcoj",-0.2023,0.158,0.714,0.128
40,nytimes,Fri Feb 02 21:20:07 +0000 2018,Salt Bae opened a steakhouse to New York City. We sent our restaurant critic @pete_wells. https://t.co/VQ1VoGD9jO,-0.2732,0.13,0.87,0.0
41,nytimes,Fri Feb 02 21:16:36 +0000 2018,"RT @amyfiscus: NEW: The FBI was a lot more forthcoming about Steele than the Nunes memo says, per the Dem memo https://t.co/EmYyFcHQ0T http…",0.0,0.0,1.0,0.0
42,nytimes,Fri Feb 02 21:13:03 +0000 2018,Breaking News: Stocks ended a bad week with a sharp drop today. Investors appear to be skittish about rising intere… https://t.co/RD6CoDXsts,-0.6808,0.248,0.752,0.0
43,nytimes,Fri Feb 02 21:05:40 +0000 2018,"What if your employer made you wear a wristband that tracked your every move, and that even nudged you when it judg… https://t.co/yERq79UXlk",0.0,0.0,1.0,0.0
44,nytimes,Fri Feb 02 20:55:00 +0000 2018,"2. ""Zora Neale Hurston Fieldwork Footage"" (1928): The author and anthropologist's look at ordinary black Southerner… https://t.co/fH92EvgSL7",0.0,0.0,1.0,0.0
45,nytimes,Fri Feb 02 20:47:14 +0000 2018,"Fettuccine with sausage and fried sage makes an elegant, satisfying 30 minute meal https://t.co/m4Lz70zseM https://t.co/S7lyzy6ZLT",0.7269,0.0,0.681,0.319
46,nytimes,Fri Feb 02 20:30:19 +0000 2018,"Rebekah Martinez was reported missing in November, despite appearing on ""The Bachelor"" and being on social media https://t.co/uJQv5rmhwR",-0.296,0.115,0.885,0.0
47,nytimes,Fri Feb 02 20:15:11 +0000 2018,The worst flu season in nearly a decade has filled emergency rooms and strained resources at medical centers. “We t… https://t.co/QUNAGTqHQm,-0.9001,0.429,0.571,0.0
48,nytimes,Fri Feb 02 20:05:03 +0000 2018,"RT @jdelreal: My latest: The Brock Turner sexual assault case drew national outrage. Now, the effort to recall the judge has revealed sharp…",-0.7964,0.253,0.747,0.0
49,nytimes,Fri Feb 02 19:55:01 +0000 2018,These girls want to compete as Jamaica's first Olympic synchronized swimmers. Here's more good news: https://t.co/SBKv9OLdrl,0.5413,0.0,0.757,0.243
50,nytimes,Fri Feb 02 19:44:52 +0000 2018,RT @amyfiscus: What's NOT in the memo might be just as important as what is. @charlie_savage is annotating it live: https://t.co/XcmiuzQJ21,0.2023,0.0,0.917,0.083
51,nytimes,Fri Feb 02 19:42:42 +0000 2018,"The full text of the memo released by House Republicans, annotated https://t.co/aez7u496OC",0.0,0.0,1.0,0.0
52,nytimes,Fri Feb 02 19:40:07 +0000 2018,"RT @nytimesmusic: When Justin Timberlake was announced as the performer for this year’s Super Bowl halftime show, the memory of one of pop’…",0.5994,0.0,0.849,0.151
53,nytimes,Fri Feb 02 19:30:13 +0000 2018,The Charleston Gazette-Mail won a Pulitzer Prize last year for its dogged coverage of West Virginia's opioid crisis… https://t.co/Vo4wRzC00V,0.7906,0.0,0.696,0.304
54,nytimes,Fri Feb 02 19:23:03 +0000 2018,The memo released by House Republicans falls short of what some promised: that it would cast doubt on the origins o… https://t.co/zyKN3U0GUl,0.0,0.1,0.8,0.1
55,nytimes,Fri Feb 02 19:15:12 +0000 2018,Alec Baldwin skewers President Trump on SNL. And supports Woody Allen and James Toback. https://t.co/VMNgGI2KXj,0.3612,0.0,0.848,0.152
56,nytimes,Fri Feb 02 19:00:18 +0000 2018,An Arizona man said he sold 720 rounds of ammunition to the Las Vegas gunman https://t.co/nmsLE0yTQa,0.0,0.0,1.0,0.0
57,nytimes,Fri Feb 02 18:50:09 +0000 2018,"The Met isn’t trying to create a slasher opera. But this director is flooding the theater's stage with over 1,000 g… https://t.co/aeZybVQf2n",0.2732,0.0,0.905,0.095
58,nytimes,Fri Feb 02 18:40:01 +0000 2018,7 Humane Society board members have resigned in protest of a decision to keep the CEO in the job despite allegation… https://t.co/eaiS33dE1d,-0.4588,0.182,0.818,0.0
59,nytimes,Fri Feb 02 18:30:09 +0000 2018,Carter Page is at the center of the Republicans' newly released memo. @nytmag wrote a profile of him in December. https://t.co/bqV3u94G1b,0.0,0.0,1.0,0.0
60,nytimes,Fri Feb 02 18:20:05 +0000 2018,"Opinion: ""He went from being a devoted and loving father and husband to someone who felt like a ghost in our home"" https://t.co/mdIktGBLLF",0.7783,0.081,0.599,0.32
61,nytimes,Fri Feb 02 18:06:52 +0000 2018,Read the full text of the previously secret memo released by House Republicans https://t.co/0tuY7RCto4,0.0,0.0,1.0,0.0
62,nytimes,Fri Feb 02 17:53:08 +0000 2018,What changes are you seeing in how sexual harassment is being dealt with in your workplace and community? Share you… https://t.co/BMOUfAjBls,-0.3182,0.142,0.769,0.089
63,nytimes,Fri Feb 02 17:42:08 +0000 2018,"Our film critics, looking at the complex history of black filmmaking in America, chose 28 essential works. Consider… https://t.co/dX1ajrKxqP",-0.296,0.109,0.891,0.0
64,nytimes,Fri Feb 02 17:36:43 +0000 2018,"Here's how to experiment with augmented reality now
https://t.co/CNxYxZOwa0",0.0,0.0,1.0,0.0
65,nytimes,Fri Feb 02 17:20:07 +0000 2018,The memo alleges that senior government officials favored Democrats over Republicans and accuses federal law enforc… https://t.co/VEgZItK9xf,0.1027,0.119,0.743,0.139
66,nytimes,Fri Feb 02 17:17:46 +0000 2018,Breaking News: House Republicans released a secret memo claiming abuses against President Trump in the Russia inqui… https://t.co/Ip4aRiIOLS,-0.5574,0.184,0.816,0.0
67,nytimes,Fri Feb 02 17:08:23 +0000 2018,"The New York Times is about to expand our journalism so you can experience it in 3 dimensions, just by picking up y… https://t.co/0vKzJUYzGa",0.3182,0.0,0.905,0.095
68,nytimes,Fri Feb 02 17:00:47 +0000 2018,"RT @NYTHealth: Flu hospitalizations have soared, the C.D.C. reports, and the death rate may surpass the 2014-2015 season when 56,000 people…",-0.7579,0.255,0.745,0.0
69,nytimes,Fri Feb 02 16:53:05 +0000 2018,"We answer your questions about applying for The Edit, a newsletter created specifically for college students and re… https://t.co/Pq7THOg12Z",0.25,0.0,0.895,0.105
70,nytimes,Fri Feb 02 16:38:03 +0000 2018,You can afford a financial planner for about the price of a bundled cable bill https://t.co/bRPPOG3ywT,0.0,0.0,1.0,0.0
71,nytimes,Fri Feb 02 16:13:04 +0000 2018,"RT @nytimesworld: The Interpreter: Six scenarios for the future of Afghanistan, and all of them admitting a form of defeat https://t.co/wh8…",-0.4588,0.136,0.864,0.0
72,nytimes,Fri Feb 02 16:03:09 +0000 2018,A father of 2 women who spoke at the sentencing hearing of Larry Nassar lunged at him across a courtroom https://t.co/od7aeIgf5k,-0.1531,0.086,0.914,0.0
73,nytimes,Fri Feb 02 15:44:05 +0000 2018,"RT @LizAldermanNYT: ""My baby almost died."" How did corporate lapses and lax oversight allow hundreds of babies to get sick in France from s…",-0.34,0.121,0.809,0.07
74,nytimes,Fri Feb 02 15:30:20 +0000 2018,Opinion: Don't believe the liberal FBI https://t.co/7dDPM6wA6L,0.0,0.0,1.0,0.0
75,nytimes,Fri Feb 02 15:20:11 +0000 2018,"A bill in Poland sets prison penalties for using phrases like ""Polish death camps"" to refer to concentration camps… https://t.co/iivhPvXqlt",-0.6908,0.28,0.623,0.097
76,nytimes,Fri Feb 02 15:10:03 +0000 2018,"The second line of Canada's anthem will soon become ""True patriot love in all of us command"" rather than ""in all th… https://t.co/RjreK5q3Lu",0.7906,0.0,0.75,0.25
77,nytimes,Fri Feb 02 15:08:54 +0000 2018,"RT @matthewhaag: “We’d have no C.E.O.s and no executives of American companies if none of them had affairs,” Humane Society board member sa…",-0.5267,0.173,0.827,0.0
78,nytimes,Fri Feb 02 15:00:28 +0000 2018,Morning Briefing: Here's what you need to know to start your day https://t.co/89lgwl53d1 https://t.co/AGSKJqLiM4,0.0,0.0,1.0,0.0
79,nytimes,Fri Feb 02 14:49:04 +0000 2018,"""For probably, say, five minutes in actual, real time, I thought I was going to be a Super Bowl champion. And then,… https://t.co/nYWf9y4cSw",0.8316,0.0,0.698,0.302
80,nytimes,Fri Feb 02 14:40:08 +0000 2018,"The Simpsons predicted the Trump presidency, the discovery of the Higgs boson particle and Disney’s takeover of Fox https://t.co/EK5ocLTOyz",0.0,0.0,1.0,0.0
81,nytimes,Fri Feb 02 14:31:04 +0000 2018,"Video: What is a ""bloody nose"" strategy in North Korea? https://t.co/GhSxeXcnoH",-0.4404,0.244,0.756,0.0
82,nytimes,Fri Feb 02 14:16:05 +0000 2018,"Last month it seemed that Democrats might ride a giant tsunami to control of the House and Senate. Now, some are wo… https://t.co/9e6iUvA3TD",0.0,0.0,1.0,0.0
83,nytimes,Fri Feb 02 14:16:01 +0000 2018,"RT @HannaIngber: An inside look at how journalists try to make sense of jobs day, by @bencasselman https://t.co/5Z26HQ9ICH",0.0,0.0,1.0,0.0
84,nytimes,Fri Feb 02 14:00:17 +0000 2018,"Nearly 50 people suspected of using and selling drugs were killed by officers in the past 2 months, the Philippine… https://t.co/HXpB5hnnzt",-0.7506,0.262,0.738,0.0
85,nytimes,Fri Feb 02 13:50:06 +0000 2018,"A trucker intentionally drove his tractor-trailer off a roadway that runs through a 2,000-year-old United Nations W… https://t.co/OjCpF1OWcy",0.4215,0.0,0.833,0.167
86,nytimes,Fri Feb 02 13:40:05 +0000 2018,Do hangovers get worse as we age? https://t.co/MSdnwwqK6M,-0.4767,0.307,0.693,0.0
87,nytimes,Fri Feb 02 13:36:54 +0000 2018,"Breaking News: The U.S. economy added 200,000 jobs in January. It was the 88th straight month that hiring increased… https://t.co/ZAYyZIHcVO",0.2263,0.0,0.909,0.091
88,nytimes,Fri Feb 02 13:30:18 +0000 2018,"Jimmy Kimmel attacked Devin Nunes, a key figure in the release of the secret GOP memo. Our late-night roundup: https://t.co/TmGN2rcoa1",-0.4588,0.143,0.857,0.0
89,nytimes,Fri Feb 02 13:20:10 +0000 2018,"A Wisconsin teenager in the ""Slender Man"" stabbing case was sentenced to 40 years in a psychiatric hospital https://t.co/qQ7FEKRGT6",-0.0258,0.064,0.936,0.0
90,nytimes,Fri Feb 02 13:11:02 +0000 2018,"Devin Nunes, the man behind a secret Republican memo, has won praise from party members he once called ""lemmings in… https://t.co/DXlHhn4W7K",0.875,0.0,0.63,0.37
91,nytimes,Fri Feb 02 13:00:23 +0000 2018,Morning Briefing: Here's what you need to know to start your day https://t.co/oDTp0MoSzS https://t.co/6AyejpbtdL,0.0,0.0,1.0,0.0
92,nytimes,Fri Feb 02 12:49:08 +0000 2018,The White House has grown frustrated by what it considers the Pentagon's reluctance to provide President Trump with… https://t.co/CGYVkXjthq,-0.7003,0.254,0.746,0.0
93,nytimes,Fri Feb 02 12:40:07 +0000 2018,The board of the Humane Society decided to retain its CEO despite an investigation that has uncovered multiple hara… https://t.co/lpMhIxwuTy,0.0,0.0,1.0,0.0
94,nytimes,Fri Feb 02 12:31:00 +0000 2018,"President Trump accused law enforcement of politicizing investigations, hours before he was expected to allow the r… https://t.co/3FxckC2Xhc",-0.0772,0.109,0.796,0.095
95,nytimes,Fri Feb 02 12:29:04 +0000 2018,"The London mosque attacker had been bingeing for weeks on far-right material and ""seemed brainwashed,"" his girlfrie… https://t.co/E3CLMPUOFh",-0.5719,0.179,0.821,0.0
96,nytimes,Fri Feb 02 12:20:04 +0000 2018,Opinion: Trump is running a bottom-line presidency in which people who know better are asked to stay quiet in excha… https://t.co/EafqNsTXQh,0.4404,0.0,0.868,0.132
97,nytimes,Fri Feb 02 12:10:05 +0000 2018,A conversation with Scott Pruitt https://t.co/tKiyfriCyh,0.0,0.0,1.0,0.0
98,nytimes,Fri Feb 02 12:00:34 +0000 2018,"Trump's eagerness to see the GOP memo made public pitted him against his own top national security officials, who h… https://t.co/3pB8r9aphX",0.7096,0.0,0.723,0.277
99,nytimes,Fri Feb 02 11:44:03 +0000 2018,Fidel Ángel Castro Díaz-Balart played a prominent role in efforts to develop nuclear energy in Cuba https://t.co/tmFZIzDsey,0.7003,0.0,0.657,0.343
